{
  "run_id": "9d2b7c41-6e58-4a30-9f12-3b7c8d9e0a1b",
  "workflow": "pull-request-review",
  "preparation": {
    "status": "submitted",
    "attempt_count": 1,
    "started_at": "2026-10-11T02:00:05.000Z",
    "finished_at": "2026-10-11T02:00:30.000Z",
    "updated_at": "2026-10-11T02:00:30.000Z",
    "failure_code": null,
    "disconnect_reason": null
  },
  "execution": {
    "status": "succeeded",
    "started_at": "2026-10-11T02:00:30.000Z",
    "finished_at": "2026-10-11T02:04:31.000Z",
    "updated_at": "2026-10-11T02:04:31.000Z"
  },
  "publication": {
    "status": "published",
    "started_at": "2026-10-11T02:06:00.000Z",
    "finished_at": "2026-10-11T02:09:12.000Z",
    "updated_at": "2026-10-11T02:09:12.000Z"
  },
  "publish_context": {
    "repository": "octo/example",
    "pull_request": 41
  },
  "execution_input": {
    "diff": "sha256:ignored-by-the-contract"
  },
  "ingress_kind": "github_webhook",
  "ingress_key": "octo/example#41",
  "created_at": "2026-10-11T02:00:00.000Z",
  "failure_code": null,
  "failure_message": null,
  "artifact_storage": {
    "status": "unavailable",
    "error_code": "ARTIFACT_STORAGE_UNAVAILABLE",
    "message": "Artifact storage credentials are not configured."
  },
  "notices": []
}
